{
  "schema_version": 4,
  "layout_id": "layout-2",
  "name": "Layout 2 — Terminal Bottom",
  "slots": [
    { "slot_id": "strip", "display_name": "Notes" },
    { "slot_id": "primary", "display_name": "Main" },
    { "slot_id": "explorer", "display_name": "Explorer" },
    { "slot_id": "secondary", "display_name": "Terminal" }
  ],
  "panels": [
    { "panel_id": "terminal" },
    { "panel_id": "terminal-cmd" },
    { "panel_id": "terminal-powershell" },
    { "panel_id": "html-viewer" },
    { "panel_id": "overview" },
    { "panel_id": "notes-strip" },
    { "panel_id": "file-browser" },
    { "panel_id": "idea-explorer" },
    { "panel_id": "backlog-explorer" }
  ],
  "default_assignment": {
    "terminal": "secondary",
    "terminal-cmd": "secondary",
    "terminal-powershell": "secondary",
    "html-viewer": "primary",
    "overview": "primary",
    "notes-strip": "strip",
    "file-browser": "explorer",
    "idea-explorer": "explorer",
    "backlog-explorer": "explorer"
  },
  "default_visible_panel": {
    "secondary": "terminal",
    "primary": "html-viewer",
    "explorer": "file-browser"
  },
  "grid": {
    "columns": ["1fr", "1fr", "1fr"],
    "rows": ["1fr", "1.6fr"],
    "areas": [
      "strip primary explorer",
      "secondary secondary secondary"
    ]
  }
}
